{
  "$schema": "https://json-schema.org/draft/2020-12/schema",
  "$id": "https://fdai.dev/schemas/scenario-manifest/1.2.0",
  "type": "object",
  "additionalProperties": false,
  "required": ["schema_version", "scenario_set_version", "status", "capability_packs"],
  "properties": {
    "schema_version": {"const": "1.2.0"},
    "scenario_set_version": {"type": "string", "pattern": "^v\\d{4}\\.\\d{2}$"},
    "status": {"enum": ["incomplete", "complete"]},
    "capability_packs": {
      "type": "object",
      "additionalProperties": false,
      "required": ["sre", "arb_change_safety", "finops", "dr", "chaos"],
      "patternProperties": {
        "^(sre|arb_change_safety|finops|dr|chaos)$": {
          "type": "object",
          "additionalProperties": false,
          "required": ["status", "scenario_ids", "conflict_spec_ids", "coverage"],
          "properties": {
            "status": {"enum": ["missing", "partial", "complete"]},
            "scenario_ids": {"type": "array", "items": {"type": "string"}, "uniqueItems": true},
            "conflict_spec_ids": {
              "description": "Frozen cross-objective conflict artifacts this pack owns, registered by their own ids so each one is directly inventoried and guarded.",
              "type": "array",
              "items": {"type": "string", "pattern": "^[a-z0-9][a-z0-9._-]{1,127}$"},
              "uniqueItems": true
            },
            "coverage": {
              "type": "object",
              "additionalProperties": false,
              "required": ["successful_full_loop", "unknown_or_deny", "cross_objective_conflict", "partial_failure_recovery", "a3e_or_non_applicability", "deterministic_replay_with_evidence"],
              "properties": {
                "successful_full_loop": {"$ref": "#/$defs/coverageEvidence"},
                "unknown_or_deny": {"$ref": "#/$defs/coverageEvidence"},
                "cross_objective_conflict": {"$ref": "#/$defs/coverageEvidence"},
                "partial_failure_recovery": {"$ref": "#/$defs/coverageEvidence"},
                "a3e_or_non_applicability": {"$ref": "#/$defs/coverageEvidence"},
                "deterministic_replay_with_evidence": {"$ref": "#/$defs/coverageEvidence"}
              }
            }
          }
        }
      }
    }
  },
  "$defs": {
    "coverageEvidence": {
      "type": "array",
      "items": {"$ref": "#/$defs/coverageEvidenceRecord"},
      "uniqueItems": true
    },
    "coverageEvidenceRecord": {
      "type": "object",
      "additionalProperties": false,
      "required": ["scenario_id", "test_ref"],
      "properties": {
        "scenario_id": {"type": "string", "minLength": 1},
        "test_ref": {
          "type": "string",
          "pattern": "^services/core-control-plane/tests/.+\\.py::test_[A-Za-z0-9_]+$"
        }
      }
    }
  }
}
