{
  "schema_version": "1.2.0",
  "scenario_set_version": "v2026.07",
  "status": "incomplete",
  "capability_packs": {
    "sre": {
      "status": "complete",
      "scenario_ids": ["sre.cluster-diagnostics-missing.001", "sre.slo-signal-source-unmapped.002", "sre.telemetry-retention-excessive.003"],
      "conflict_spec_ids": ["sre.cross-objective-conflict.v2026-07"],
      "coverage": {"successful_full_loop": [{"scenario_id": "sre.cluster-diagnostics-missing.001", "test_ref": "services/core-control-plane/tests/scenarios/test_v2026_07_replay.py::test_sre_successful_full_loop_closes_only_on_independent_effect_observation"}, {"scenario_id": "sre.cluster-diagnostics-missing.001", "test_ref": "services/core-control-plane/tests/scenarios/test_v2026_07_replay.py::test_sre_full_loop_fails_closed_on_deficient_effect_evidence"}, {"scenario_id": "sre.cluster-diagnostics-missing.001", "test_ref": "services/core-control-plane/tests/scenarios/test_v2026_07_replay.py::test_sre_full_loop_dispatch_without_observation_is_never_success"}], "unknown_or_deny": [{"scenario_id": "sre.slo-signal-source-unmapped.002", "test_ref": "services/core-control-plane/tests/scenarios/test_v2026_07_replay.py::test_v2026_07_scenario_replays_through_control_loop"}], "cross_objective_conflict": [{"scenario_id": "sre.cluster-diagnostics-missing.001", "test_ref": "services/core-control-plane/tests/scenarios/test_v2026_07_replay.py::test_sre_cross_objective_conflict_reaches_governed_arbitration"}, {"scenario_id": "sre.slo-signal-source-unmapped.002", "test_ref": "services/core-control-plane/tests/scenarios/test_v2026_07_replay.py::test_sre_cross_objective_conflict_reaches_governed_arbitration"}, {"scenario_id": "sre.telemetry-retention-excessive.003", "test_ref": "services/core-control-plane/tests/scenarios/test_v2026_07_replay.py::test_sre_cross_objective_conflict_reaches_governed_arbitration"}, {"scenario_id": "sre.slo-signal-source-unmapped.002", "test_ref": "services/core-control-plane/tests/scenarios/test_v2026_07_replay.py::test_sre_cross_objective_conflict_closes_hil_without_arbitration_authority"}], "partial_failure_recovery": [{"scenario_id": "sre.cluster-diagnostics-missing.001", "test_ref": "services/core-control-plane/tests/scenarios/test_v2026_07_replay.py::test_sre_partial_publish_failure_closes_the_audit_and_recovers_on_retry"}], "a3e_or_non_applicability": [{"scenario_id": "sre.slo-signal-source-unmapped.002", "test_ref": "services/core-control-plane/tests/scenarios/test_v2026_07_replay.py::test_sre_unknown_terminates_before_a3e_authority_is_applicable"}], "deterministic_replay_with_evidence": [{"scenario_id": "sre.cluster-diagnostics-missing.001", "test_ref": "services/core-control-plane/tests/scenarios/test_v2026_07_replay.py::test_v2026_07_scenario_replays_through_control_loop"}, {"scenario_id": "sre.slo-signal-source-unmapped.002", "test_ref": "services/core-control-plane/tests/scenarios/test_v2026_07_replay.py::test_v2026_07_scenario_replays_through_control_loop"}, {"scenario_id": "sre.telemetry-retention-excessive.003", "test_ref": "services/core-control-plane/tests/scenarios/test_v2026_07_replay.py::test_v2026_07_scenario_replays_through_control_loop"}, {"scenario_id": "sre.cluster-diagnostics-missing.001", "test_ref": "services/core-control-plane/tests/scenarios/test_v2026_07_replay.py::test_sre_cross_objective_conflict_replays_to_stable_digests"}, {"scenario_id": "sre.slo-signal-source-unmapped.002", "test_ref": "services/core-control-plane/tests/scenarios/test_v2026_07_replay.py::test_sre_cross_objective_conflict_replays_to_stable_digests"}, {"scenario_id": "sre.telemetry-retention-excessive.003", "test_ref": "services/core-control-plane/tests/scenarios/test_v2026_07_replay.py::test_sre_cross_objective_conflict_replays_to_stable_digests"}]}
    },
    "arb_change_safety": {
      "status": "partial",
      "scenario_ids": ["change.drift-manual-portal-edit.003", "change.nsg-allow-any-inbound.002", "change.tag-owner-missing.001"],
      "conflict_spec_ids": [],
      "coverage": {"successful_full_loop": [], "unknown_or_deny": [], "cross_objective_conflict": [], "partial_failure_recovery": [], "a3e_or_non_applicability": [], "deterministic_replay_with_evidence": [{"scenario_id": "change.drift-manual-portal-edit.003", "test_ref": "services/core-control-plane/tests/scenarios/test_v2026_07_replay.py::test_v2026_07_scenario_replays_through_control_loop"}, {"scenario_id": "change.nsg-allow-any-inbound.002", "test_ref": "services/core-control-plane/tests/scenarios/test_v2026_07_replay.py::test_v2026_07_scenario_replays_through_control_loop"}, {"scenario_id": "change.tag-owner-missing.001", "test_ref": "services/core-control-plane/tests/scenarios/test_v2026_07_replay.py::test_v2026_07_scenario_replays_through_control_loop"}]}
    },
    "finops": {
      "status": "partial",
      "scenario_ids": ["finops.right-size-vm-high-monthly.002", "finops.stop-idle-dev-vm-off-hours.003", "finops.unattached-public-ip.001"],
      "conflict_spec_ids": [],
      "coverage": {"successful_full_loop": [], "unknown_or_deny": [], "cross_objective_conflict": [], "partial_failure_recovery": [], "a3e_or_non_applicability": [], "deterministic_replay_with_evidence": [{"scenario_id": "finops.right-size-vm-high-monthly.002", "test_ref": "services/core-control-plane/tests/scenarios/test_v2026_07_replay.py::test_v2026_07_scenario_replays_through_control_loop"}, {"scenario_id": "finops.stop-idle-dev-vm-off-hours.003", "test_ref": "services/core-control-plane/tests/scenarios/test_v2026_07_replay.py::test_v2026_07_scenario_replays_through_control_loop"}, {"scenario_id": "finops.unattached-public-ip.001", "test_ref": "services/core-control-plane/tests/scenarios/test_v2026_07_replay.py::test_v2026_07_scenario_replays_through_control_loop"}]}
    },
    "dr": {
      "status": "partial",
      "scenario_ids": ["dr.backup-vault-restore-rehearsal.002", "dr.replica-lag-degraded.001"],
      "conflict_spec_ids": [],
      "coverage": {"successful_full_loop": [], "unknown_or_deny": [], "cross_objective_conflict": [], "partial_failure_recovery": [], "a3e_or_non_applicability": [], "deterministic_replay_with_evidence": [{"scenario_id": "dr.backup-vault-restore-rehearsal.002", "test_ref": "services/core-control-plane/tests/scenarios/test_v2026_07_replay.py::test_v2026_07_scenario_replays_through_control_loop"}, {"scenario_id": "dr.replica-lag-degraded.001", "test_ref": "services/core-control-plane/tests/scenarios/test_v2026_07_replay.py::test_v2026_07_scenario_replays_through_control_loop"}]}
    },
    "chaos": {
      "status": "partial",
      "scenario_ids": ["dr.chaos-experiment-novel.003"],
      "conflict_spec_ids": [],
      "coverage": {"successful_full_loop": [], "unknown_or_deny": [], "cross_objective_conflict": [], "partial_failure_recovery": [], "a3e_or_non_applicability": [{"scenario_id": "dr.chaos-experiment-novel.003", "test_ref": "services/core-control-plane/tests/scenarios/test_v2026_07_replay.py::test_v2026_07_scenario_replays_through_control_loop"}], "deterministic_replay_with_evidence": [{"scenario_id": "dr.chaos-experiment-novel.003", "test_ref": "services/core-control-plane/tests/scenarios/test_v2026_07_replay.py::test_v2026_07_scenario_replays_through_control_loop"}]}
    }
  }
}
